{
  "model_name": "vae",
  "version": "v2026-04-22-0400",
  "authorizer": {
    "principal": "ml-governance-bot@afds.internal",
    "role": "ml-governance",
    "approved_at": "2026-04-22T04:05:00Z",
    "ticket_url": "https://linear.app/afds/issue/AFDS-0001/phase-d-vae-placeholder"
  },
  "trained_at": "2026-04-22T04:03:12Z",
  "training": {
    "horizon_days": 14,
    "n_samples": 2000,
    "n_positive_labels": 0,
    "n_negative_labels": 2000,
    "dataset": "synthetic_placeholder_v1",
    "feature_names": [
      "amount_log",
      "velocity_count",
      "hour_of_day",
      "is_weekend",
      "entity_risk",
      "ip_risk",
      "phone_risk",
      "email_risk",
      "cop_reason",
      "geo_mismatch"
    ],
    "git_sha": "placeholder",
    "seed": 42
  },
  "baseline": {
    "psi_at_promotion": 0.0,
    "calibration_path": "s3://afds-models/models/vae/v2026-04-22-0400/calibration.json",
    "score_percentiles": {
      "p05": 0.09,
      "p50": 0.37,
      "p95": 1.02,
      "p99": 1.78
    }
  },
  "metrics": {
    "precision": 0.0,
    "recall": 0.0,
    "f1": 0.0,
    "auc": 0.5,
    "auc_uplift_vs_rules_pp": 0.0,
    "timeout_rate": 0.0,
    "p95_latency_ms": 0.0
  },
  "governance": {
    "rollout_mode_at_promotion": "shadow",
    "canary_start_percentage": 0,
    "kill_switch_drill": {
      "run_at": "2026-04-22T04:04:00Z",
      "p99_us": 0.0,
      "passed": true,
      "iterations": 10000
    },
    "parity_gate": {
      "passed": 49,
      "total": 49,
      "report_url": "data-pipeline/scored-output/public_validation_report.json"
    },
    "notes": "Placeholder identity-ONNX. Advisory only; MUST NOT be promoted beyond shadow until replaced with a real VAE trained on IEEE-CIS or licensed internal datasets."
  }
}
